{
  "api_version": 1,
  "os_family": "ubuntu",
  "created_at": "2025-01-15T10:30:00Z",
  "steps": [
    {
      "order": 0,
      "name": "base.sh",
      "sha256": "e3b0c44298fc1c149afbf4c8996fb92427ae41e4649b934ca495991b7852b855"
    },
    {
      "order": 1,
      "name": "human-user.sh",
      "sha256": "a7ffc6f8bf1ed76651c14756a061d662f580ff4de43b49fa82d80a4b80f8434a"
    },
    {
      "order": 2,
      "name": "finish.sh",
      "sha256": "ba7816bf8f01cfea414140de5dae2223b00361a396177a9cb410ff61f20015ad"
    }
  ]
}
